{"v":1,"ts_ms":1757448897538,"engine":"dlx","run_id":"2025-09-09T20-14-54Z","container":{"cid":"9593dfcda8b95fdcdb91a2ed875765b86602258a62f9d50b593ac202f8f178db","cells":16},"k":208,"nodes":2228,"pruned":0,"depth":1,"best_depth":null,"solutions":3,"elapsed_ms":2572,"stack":[{"piece":1,"orient":5,"i":0,"j":0,"k":0}],"stack_truncated":false,"hash_container_cid":"9593dfcda8b95fdcdb91a2ed875765b86602258a62f9d50b593ac202f8f178db","hash_solution_sid":null,"phase":"test_dlx"}