{"v":1,"ts_ms":1757448737582,"engine":"dfs","run_id":"2025-09-09T20-12-15Z","container":{"cid":"1e4197ae72c11a705f688224d75377bc3e17c19e2f96ed13b3327c34492237cd","cells":100},"k":null,"nodes":1069,"pruned":0,"depth":12,"best_depth":12,"solutions":0,"elapsed_ms":1726,"stack":[{"piece":0,"orient":11,"i":-4,"j":4,"k":4},{"piece":3,"orient":15,"i":-4,"j":4,"k":5},{"piece":2,"orient":11,"i":-3,"j":3,"k":3},{"piece":4,"orient":12,"i":-3,"j":3,"k":6},{"piece":5,"orient":15,"i":-2,"j":2,"k":2},{"piece":6,"orient":7,"i":-2,"j":2,"k":4},{"piece":7,"orient":0,"i":-2,"j":2,"k":5},{"piece":8,"orient":1,"i":-1,"j":1,"k":1},{"piece":9,"orient":11,"i":-1,"j":1,"k":3},{"piece":12,"orient":19,"i":-1,"j":1,"k":7},{"piece":17,"orient":4,"i":-1,"j":1,"k":8},{"piece":20,"orient":6,"i":-1,"j":3,"k":4}],"stack_truncated":false,"hash_container_cid":"1e4197ae72c11a705f688224d75377bc3e17c19e2f96ed13b3327c34492237cd","hash_solution_sid":null,"phase":null}